{
  "schema_version": "2.0.0",
  "metadata": {
    "author": "OrderPilot-AI",
    "created_at": "2026-01-25T07:55:45Z",
    "updated_at": "2026-01-25T07:55:45Z",
    "tags": [
      "BTCUSDT",
      "5m",
      "regime",
      "optimization"
    ],
    "notes": "Rank #1 optimization result applied on 2026-01-25 07:55:45 UTC. Score: 59.00. Trial: 1",
    "trading_style": "Daytrading",
    "description": "Optimized regime configuration for BTCUSDT 5m with 3 indicators and 3 regimes."
  },
  "optimization_results": [
    {
      "timestamp": "2026-01-25T07:55:45Z",
      "score": 59.0,
      "trial_number": 1,
      "applied": true,
      "indicators": [
        {
          "name": "MOMENTUM_RSI",
          "type": "RSI",
          "params": [
            {
              "name": "period",
              "value": 20,
              "range": {
                "min": 5,
                "max": 50,
                "step": 1
              }
            },
            {
              "name": "strong_bear",
              "value": 48,
              "range": {
                "min": 30,
                "max": 50,
                "step": 1
              }
            },
            {
              "name": "strong_bull",
              "value": 65,
              "range": {
                "min": 50,
                "max": 70,
                "step": 1
              }
            }
          ]
        },
        {
          "name": "STRENGTH_ADX",
          "type": "ADX",
          "params": [
            {
              "name": "period",
              "value": 17,
              "range": {
                "min": 5,
                "max": 50,
                "step": 1
              }
            },
            {
              "name": "trending_threshold",
              "value": 30,
              "range": {
                "min": 20,
                "max": 40,
                "step": 1
              }
            },
            {
              "name": "weak_threshold",
              "value": 18,
              "range": {
                "min": 15,
                "max": 25,
                "step": 1
              }
            },
            {
              "name": "di_diff_threshold",
              "value": 6,
              "range": {
                "min": 3,
                "max": 15,
                "step": 1
              }
            }
          ]
        },
        {
          "name": "VOLATILITY_ATR",
          "type": "ATR",
          "params": [
            {
              "name": "period",
              "value": 20,
              "range": {
                "min": 5,
                "max": 50,
                "step": 1
              }
            },
            {
              "name": "extreme_move_pct",
              "value": 4.2,
              "range": {
                "min": 2.0,
                "max": 5.0,
                "step": 0.5
              }
            },
            {
              "name": "strong_move_pct",
              "value": 2.1,
              "range": {
                "min": 0.5,
                "max": 3.0,
                "step": 0.1
              }
            }
          ]
        }
      ],
      "regimes": [
        {
          "id": "BULL",
          "name": "Bullischer Trend",
          "thresholds": [
            {
              "name": "adx_min",
              "value": 30.0,
              "range": {
                "min": 15,
                "max": 40,
                "step": 1
              }
            },
            {
              "name": "di_diff_min",
              "value": 6.0,
              "range": {
                "min": 3,
                "max": 15,
                "step": 1
              }
            },
            {
              "name": "rsi_strong_bull",
              "value": 65.0,
              "range": {
                "min": 50,
                "max": 70,
                "step": 1
              }
            },
            {
              "name": "extreme_move_pct",
              "value": 4.2,
              "range": {
                "min": 2.0,
                "max": 5.0,
                "step": 0.5
              }
            }
          ],
          "priority": 90,
          "scope": "entry"
        },
        {
          "id": "BEAR",
          "name": "Bärischer Trend",
          "thresholds": [
            {
              "name": "adx_min",
              "value": 30.0,
              "range": {
                "min": 15,
                "max": 40,
                "step": 1
              }
            },
            {
              "name": "di_diff_min",
              "value": 6.0,
              "range": {
                "min": 3,
                "max": 15,
                "step": 1
              }
            },
            {
              "name": "rsi_strong_bear",
              "value": 48.0,
              "range": {
                "min": 30,
                "max": 50,
                "step": 1
              }
            },
            {
              "name": "extreme_move_pct",
              "value": 4.2,
              "range": {
                "min": 2.0,
                "max": 5.0,
                "step": 0.5
              }
            }
          ],
          "priority": 85,
          "scope": "entry"
        },
        {
          "id": "SIDEWAYS",
          "name": "Seitwärts / Range",
          "thresholds": [
            {
              "name": "adx_max",
              "value": 18.0,
              "range": {
                "min": 15,
                "max": 30,
                "step": 1
              }
            }
          ],
          "priority": 50,
          "scope": "entry"
        }
      ]
    }
  ],
  "entry_params": {
    "min_score": 70,
    "require_regime_match": true,
    "max_signals_per_regime": 5
  },
  "evaluation_params": {
    "lookback_periods": 200,
    "min_regime_duration": 3,
    "score_weights": {
      "regime_distribution": 0.3,
      "regime_stability": 0.3,
      "indicator_quality": 0.4
    }
  }
}