{
  "schema_version": "2.0.0",
  "metadata": {
    "author": "OrderPilot-AI",
    "created_at": "2026-01-25T00:00:00Z",
    "updated_at": "2026-01-25T00:00:00Z",
    "tags": ["BTCUSDT", "sideways", "scalping", "mean-reversion"],
    "notes": "Spezialisiert auf Mean-Reversion in Seitwärtsmärkten. Erkennt Range-Extrema und Squeezes."
  },
  "optimization_results": [
    {
      "timestamp": "2026-01-25T00:00:00Z",
      "score": 0.0,
      "trial_number": 1,
      "applied": true,
      "indicators": [
        {
          "name": "RANGE_BB",
          "type": "BB",
          "params": [
            {
              "name": "period",
              "value": 20,
              "range": {"min": 15, "max": 30, "step": 1}
            },
            {
              "name": "std_dev",
              "value": 2.0,
              "range": {"min": 1.5, "max": 2.5, "step": 0.1}
            }
          ]
        },
        {
          "name": "FAST_STOCH",
          "type": "STOCH",
          "params": [
            {
              "name": "period",
              "value": 14,
              "range": {"min": 9, "max": 20, "step": 1}
            },
            {
              "name": "smooth_k",
              "value": 3,
              "range": {"min": 1, "max": 5, "step": 1}
            }
          ]
        },
        {
          "name": "VWAP_ANCHOR",
          "type": "VWAP",
          "params": []
        }
      ],
      "regimes": [
        {
          "id": "RANGE_LOW",
          "name": "Range Bottom Reversal",
          "thresholds": [
            {
              "name": "stoch_low",
              "value": 20.0,
              "range": {"min": 10, "max": 30, "step": 1}
            }
          ],
          "priority": 80,
          "scope": "entry"
        },
        {
          "id": "RANGE_HIGH",
          "name": "Range Top Reversal",
          "thresholds": [
            {
              "name": "stoch_high",
              "value": 80.0,
              "range": {"min": 70, "max": 90, "step": 1}
            }
          ],
          "priority": 80,
          "scope": "entry"
        },
        {
          "id": "VOLA_SQUEEZE",
          "name": "Tight Consolidation",
          "thresholds": [
            {
              "name": "bb_width_max",
              "value": 0.012,
              "range": {"min": 0.005, "max": 0.02, "step": 0.001}
            }
          ],
          "priority": 70,
          "scope": "entry"
        }
      ]
    }
  ],
  "entry_params": {
    "pullback_atr": 0.5,
    "pullback_rsi": 50.0,
    "wick_reject": 0.65,
    "bb_entry": 0.1,
    "rsi_oversold": 30.0,
    "rsi_overbought": 70.0,
    "vol_spike_factor": 1.1,
    "breakout_atr": 0.15,
    "min_confidence": 0.55,
    "cooldown_bars": 8,
    "cluster_window_bars": 4
  },
  "evaluation_params": {
    "eval_horizon_bars": 25,
    "eval_tp_atr": 0.8,
    "eval_sl_atr": 0.6,
    "min_trades_gate": 15,
    "target_trades_soft": 45
  }
}