{
  "schema_version": "2.0.0",
  "metadata": {
    "author": "OrderPilot-AI",
    "created_at": "2026-01-24T00:00:00Z",
    "updated_at": "2026-01-24T00:00:00Z",
    "tags": [
      "entry-analyzer",
      "regime",
      "template"
    ],
    "notes": "⚠️ GENERIC TEMPLATE v2.0 - Supports ANY indicator with ANY parameters (1-10 params per indicator). Examples below are just suggestions - replace with YOUR indicators! See .md for all 12+ supported indicator types.",
    "trading_style": "Example: Daytrading",
    "description": "Example: Trend-following strategy for identifying and scalping sideways market phases"
  },
  "optimization_results": [
    {
      "timestamp": "2026-01-24T00:00:00Z",
      "score": 0.0,
      "trial_number": 0,
      "applied": false,
      "indicators": [
        {
          "name": "EXAMPLE_INDICATOR_1",
          "type": "RSI",
          "params": [
            {
              "name": "period",
              "value": 14,
              "range": {
                "min": 9,
                "max": 20,
                "step": 1
              }
            }
          ]
        }
      ],
      "regimes": [
        {
          "id": "EXAMPLE_REGIME_1",
          "name": "Example Market Phase",
          "thresholds": [
            {
              "name": "example_threshold",
              "value": 50.0,
              "range": {
                "min": 30,
                "max": 70,
                "step": 1
              }
            }
          ],
          "priority": 60,
          "scope": "entry"
        }
      ]
    }
  ],
  "entry_params": {
    "pullback_atr": 0.8,
    "pullback_rsi": 45.0,
    "wick_reject": 0.55,
    "bb_entry": 0.15,
    "rsi_oversold": 35.0,
    "rsi_overbought": 65.0,
    "vol_spike_factor": 1.2,
    "breakout_atr": 0.2,
    "min_confidence": 0.58,
    "cooldown_bars": 10,
    "cluster_window_bars": 6
  },
  "evaluation_params": {
    "eval_horizon_bars": 40,
    "eval_tp_atr": 1.0,
    "eval_sl_atr": 0.8,
    "min_trades_gate": 8,
    "target_trades_soft": 30
  }
}
