{
  "schema_version": "2.0.0",
  "metadata": {
    "author": "OrderPilot-AI",
    "created_at": "2026-01-25T00:00:00Z",
    "updated_at": "2026-01-25T00:00:00Z",
    "tags": ["BTCUSDT", "regime", "trend-following"],
    "notes": "Optimal für Trend-Scalping. Nutzt EMA 200 zur Richtungserkennung und ADX zur Filterung von Seitwärts-Rauschen."
  },
  "optimization_results": [
    {
      "timestamp": "2026-01-25T00:00:00Z",
      "score": 0.0,
      "trial_number": 1,
      "applied": true,
      "indicators": [
        {
          "name": "TREND_FILTER",
          "type": "EMA",
          "params": [
            {
              "name": "period",
              "value": 200,
              "range": {"min": 100, "max": 200, "step": 10}
            }
          ]
        },
        {
          "name": "STRENGTH_ADX",
          "type": "ADX",
          "params": [
            {
              "name": "period",
              "value": 14,
              "range": {"min": 10, "max": 25, "step": 1}
            }
          ]
        },
        {
          "name": "MOMENTUM_RSI",
          "type": "RSI",
          "params": [
            {
              "name": "period",
              "value": 14,
              "range": {"min": 9, "max": 21, "step": 1}
            }
          ]
        }
      ],
      "regimes": [
        {
          "id": "BULL_TREND",
          "name": "Strong Bullish Bias",
          "thresholds": [
            {
              "name": "adx_min",
              "value": 25.0,
              "range": {"min": 20, "max": 35, "step": 1}
            },
            {
              "name": "rsi_min",
              "value": 55.0,
              "range": {"min": 50, "max": 65, "step": 1}
            }
          ],
          "priority": 90,
          "scope": "entry"
        },
        {
          "id": "BEAR_TREND",
          "name": "Strong Bearish Bias",
          "thresholds": [
            {
              "name": "adx_min",
              "value": 25.0,
              "range": {"min": 20, "max": 35, "step": 1}
            },
            {
              "name": "rsi_max",
              "value": 45.0,
              "range": {"min": 35, "max": 50, "step": 1}
            }
          ],
          "priority": 85,
          "scope": "entry"
        },
        {
          "id": "CHOP_ZONE",
          "name": "Volatile Sideways / No Trade",
          "thresholds": [
            {
              "name": "adx_max",
              "value": 20.0,
              "range": {"min": 15, "max": 25, "step": 1}
            }
          ],
          "priority": 70,
          "scope": "entry"
        }
      ]
    }
  ],
  "entry_params": {
    "pullback_atr": 0.8,
    "pullback_rsi": 45.0,
    "wick_reject": 0.55,
    "bb_entry": 0.15,
    "rsi_oversold": 35.0,
    "rsi_overbought": 65.0,
    "vol_spike_factor": 1.2,
    "breakout_atr": 0.2,
    "min_confidence": 0.60,
    "cooldown_bars": 12,
    "cluster_window_bars": 6
  },
  "evaluation_params": {
    "eval_horizon_bars": 40,
    "eval_tp_atr": 1.2,
    "eval_sl_atr": 0.8,
    "min_trades_gate": 10,
    "target_trades_soft": 35
  }
}